{
  "$schema": "https://json-schema.org/draft/2020-12/schema",
  "type": "object",
  "properties": {
    "slug": {
      "type": "string"
    },
    "sku": {
      "anyOf": [
        {
          "type": "string"
        },
        {
          "type": "null"
        }
      ]
    },
    "gtin13": {
      "anyOf": [
        {
          "type": "string"
        },
        {
          "type": "null"
        }
      ]
    },
    "jsonLd": {
      "anyOf": [
        {
          "type": "string"
        },
        {
          "type": "null"
        }
      ]
    },
    "title": {
      "type": "string"
    },
    "heading": {
      "type": "string"
    },
    "description": {
      "type": "string"
    },
    "bodyDescription": {
      "anyOf": [
        {
          "type": "string"
        },
        {
          "type": "null"
        }
      ]
    },
    "ogTitle": {
      "type": "string"
    },
    "ogDescription": {
      "type": "string"
    },
    "canonical": {
      "type": "string"
    },
    "images": {
      "type": "array",
      "items": {
        "type": "object",
        "properties": {
          "src": {
            "type": "string"
          },
          "alt": {
            "type": "string"
          }
        },
        "required": [
          "src",
          "alt"
        ]
      }
    },
    "sliderPrevLabel": {
      "type": "string"
    },
    "sliderNextLabel": {
      "type": "string"
    },
    "available": {
      "anyOf": [
        {
          "type": "object",
          "properties": {
            "label": {
              "type": "string"
            },
            "value": {
              "type": "string"
            }
          },
          "required": [
            "label",
            "value"
          ]
        },
        {
          "type": "null"
        }
      ]
    },
    "ctaHref": {
      "anyOf": [
        {
          "type": "string"
        },
        {
          "type": "null"
        }
      ]
    },
    "composition": {
      "anyOf": [
        {
          "type": "string"
        },
        {
          "type": "null"
        }
      ]
    },
    "analyticalComponents": {
      "anyOf": [
        {
          "type": "string"
        },
        {
          "type": "null"
        }
      ]
    },
    "additives": {
      "anyOf": [
        {
          "type": "string"
        },
        {
          "type": "null"
        }
      ]
    },
    "benefits": {
      "type": "array",
      "items": {
        "type": "object",
        "properties": {
          "icon": {
            "anyOf": [
              {
                "type": "string"
              },
              {
                "type": "null"
              }
            ]
          },
          "iconAlt": {
            "anyOf": [
              {
                "type": "string"
              },
              {
                "type": "null"
              }
            ]
          },
          "description": {
            "type": "string"
          }
        },
        "required": [
          "icon",
          "iconAlt",
          "description"
        ]
      }
    },
    "extraHtml": {
      "anyOf": [
        {
          "type": "string"
        },
        {
          "type": "null"
        }
      ]
    },
    "$schema": {
      "type": "string"
    }
  },
  "required": [
    "slug",
    "sku",
    "gtin13",
    "jsonLd",
    "title",
    "heading",
    "description",
    "bodyDescription",
    "ogTitle",
    "ogDescription",
    "canonical",
    "images",
    "sliderPrevLabel",
    "sliderNextLabel",
    "available",
    "ctaHref",
    "composition",
    "analyticalComponents",
    "additives",
    "benefits",
    "extraHtml"
  ]
}