{
	"slug": "pate-with-chicken-and-lamb",
	"sku": "20571",
	"gtin13": "8711242016903",
	"jsonLd": "{\n      \"@context\": \"https://schema.org\",\n      \"@type\": \"Product\",\n      \"description\": \" This delicious paté treat made with chicken and lamb is a veritable delicacy for every cat!  The natural ingredients are steamed so that the nutritious properties are well preserved. Cleaning and preparing the chicken and lamb, filling cans and adding toppings are all done manually. This delicious gluten-free paté treat is a real treat for any cat that loves meat ! \",\n    \"name\": \"PATÉ   WITH CHICKEN & LAMB\",\n    \"image\": \"https://sanux.100.nl/uploads/gdpetfood.com/original/gs1_20571_pate_with_chicken_and_lamb_blik1.png\",\n    \"sku\": \"20571\",\n    \"gtin13\": \"8711242016903\",\n    \"brand\": {\n      \"@type\": \"Brand\",\n      \"name\": \"Voskes\"\n    }\n  }",
	"title": "Paté with chicken and lamb | Voskes",
	"heading": "پته  WITH CHICKEN & LAMB",
	"description": "This cat snack is a delicious chicken and lamb-based treat. A real treat for any cat!",
	"bodyDescription": "This delicious paté treat made with chicken and lamb is a veritable delicacy for every cat!The natural ingredients are steamed so that the nutritious properties are well preserved. Cleaning and preparing the chicken and lamb, filling cans and adding toppings are all done manually. This delicious gluten-free paté treat is a real treat for any cat that loves meat !",
	"ogTitle": "Paté with chicken and lamb | Voskes",
	"ogDescription": "This cat snack is a delicious chicken and lamb-based treat. A real treat for any cat!",
	"canonical": "https://voskes.nl/en/products/pate-with-chicken-and-lamb",
	"images": [
		{
			"src": "https://sanux.100.nl/uploads/gdpetfood.com/original/gs1_20571_pate_with_chicken_and_lamb_blik1.webp",
			"alt": "PATÉ WITH CHICKEN & LAMB | PATÉ WETFOOD WITH CHICKEN & LAMB | VOSKES"
		},
		{
			"src": "https://sanux.100.nl/uploads/gdpetfood.com/original/gs1_20571_pate_with_chicken_and_lamb1.webp",
			"alt": "PATÉ WITH CHICKEN & LAMB | PATÉ WETFOOD WITH CHICKEN & LAMB | VOSKES"
		}
	],
	"sliderPrevLabel": "اسلاید قبلی",
	"sliderNextLabel": "اسلاید بعدی",
	"available": {
		"label": "موجود در",
		"value": "۸۵ گرم"
	},
	"ctaHref": "https://www.mypetfoodshop.com/products/8711242016903",
	"composition": "chicken 21%, lamb 11%, vegetable gelatine 1%, tapioca starch, glycine, xylose, pea protein, sodium tripolyphosphate, sunflower oil, sodium chloride, potassium chloride",
	"analyticalComponents": "moisture 85%, crude protein 5%, crude ash 1,0%, crude oils & fats 5,0%, crude fibre 0,5%.",
	"additives": null,
	"benefits": [],
	"extraHtml": null
}
