{
	"slug": "biscuits-with-bonito",
	"sku": "21555",
	"gtin13": "8711242018426",
	"jsonLd": "{\n      \"@context\": \"https://schema.org\",\n      \"@type\": \"Product\",\n      \"description\": \" Spoil your cat with Voskes Crispy & Crunchy treats! The perfect combination of a crunchy exterior and a soft, tasty filling. Enriched with taurine for a healthy heart, these snacks are ideal as a treat or reward. A delicious delight your house tiger will come back to again and again! \",\n    \"name\": \"BISCUITS WITH BONITO\",\n    \"image\": \"https://sanux.100.nl/uploads/gdpetfood.com/original/21555-biscuits-with-bonito-gs1.png\",\n    \"sku\": \"21555\",\n    \"gtin13\": \"8711242018426\",\n    \"brand\": {\n      \"@type\": \"Brand\",\n      \"name\": \"Voskes\"\n    }\n  }",
	"title": "Biscuits with bonito | Voskes",
	"heading": "BISCUITS WITH BONITO",
	"description": "Spoil your cat with Voskes Crispy & Crunchy treats! The perfect combination of a crunchy exterior and a soft, tasty filling. Enriched with taurine.",
	"bodyDescription": "Spoil your cat with Voskes Crispy & Crunchy treats! The perfect combination of a crunchy exterior and a soft, tasty filling. Enriched with taurine for a healthy heart, these snacks are ideal as a treat or reward. A delicious delight your house tiger will come back to again and again!",
	"ogTitle": "Biscuits with bonito | Voskes",
	"ogDescription": "Spoil your cat with Voskes Crispy & Crunchy treats! The perfect combination of a crunchy exterior and a soft, tasty filling. Enriched with taurine.",
	"canonical": "https://voskes.nl/en/products/biscuits-with-bonito",
	"images": [
		{
			"src": "https://sanux.100.nl/uploads/gdpetfood.com/original/21555-biscuits-with-bonito-gs1-p.webp",
			"alt": "BISCUITS WITH BONITO |  | VOSKES"
		},
		{
			"src": "https://sanux.100.nl/uploads/gdpetfood.com/original/21555-biscuits-with-bonito-inhoud-gs1-p.webp",
			"alt": "BISCUITS WITH BONITO |  | VOSKES"
		}
	],
	"sliderPrevLabel": "اسلاید قبلی",
	"sliderNextLabel": "اسلاید بعدی",
	"available": {
		"label": "موجود در",
		"value": "۶۰ گرم"
	},
	"ctaHref": "https://www.mypetfoodshop.com/products/8711242018426",
	"composition": "Derivatives of vegetable origin, meat and animal derivatives, fish and fish derivatives (bonito 12%), oils and fats, milk and milk derivatives, minerals",
	"analyticalComponents": "Moisture 10%, crude protein 18%, crude ash 8%, crude oils & fats 16%, crude fibre 4%",
	"additives": "Taurine 2000 mg/kg",
	"benefits": [],
	"extraHtml": null
}
