{
	"slug": "chicken-breast-fillets",
	"sku": "18332",
	"gtin13": "87 112 42 93199 2",
	"jsonLd": "{\n  \"@context\": \"https://schema.org\",\n  \"@type\": \"Product\",\n  \"description\": \"این غذای خوشمزه حاوی 100% سینه مرغ تازه، بدون رنگ، طعم دهنده یا مواد نگهدارنده اضافه شده است. این فیله مرغ خشک کم چرب و به راحتی قابل هضم است و برای سگ های دارای اضافه وزن و آلرژی عالی است. علاوه بر این، این میان وعده منبع غنی و مغذی پروتئین حیوانی است که برای نیازهای غذایی سگ شما ضروری است.\",\n  \"name\": \"CHICKEN BREAST FILLETS\",\n  \"image\": \"/uploads/gdpetfood.com/gs1/gs1-18332_-_chicken_breast_fillets_400g-gs1-gs1_packshot-2064-197.png?v=bUfzGF\",\n  \"sku\": \"18332\",\n  \"gtin13\": \"87 112 42 93199 2\",\n  \"brand\": {\n    \"@type\": \"Brand\",\n    \"name\": \"Voskes\"\n  }\n}",
	"title": "فیله سینه مرغ | Voskes",
	"heading": "فیله سینه مرغ",
	"description": "این خوراکی از ۱۰۰٪ سینه مرغ تازه تهیه شده؛ بدون رنگ، طعم‌دهنده و نگهدارنده، کم‌چرب و به‌راحتی قابل هضم.",
	"bodyDescription": "این غذای خوشمزه حاوی 100% سینه مرغ تازه، بدون رنگ، طعم دهنده یا مواد نگهدارنده اضافه شده است. این فیله مرغ خشک کم چرب و به راحتی قابل هضم است و برای سگ های دارای اضافه وزن و آلرژی عالی است. علاوه بر این، این میان وعده منبع غنی و مغذی پروتئین حیوانی است که برای نیازهای غذایی سگ شما ضروری است.",
	"ogTitle": "فیله سینه مرغ | Voskes",
	"ogDescription": "این خوراکی از ۱۰۰٪ سینه مرغ تازه تهیه شده؛ بدون رنگ، طعم‌دهنده و نگهدارنده، کم‌چرب و به‌راحتی قابل هضم.",
	"canonical": "https://voskes.ir/products/chicken-breast-fillets",
	"images": [
		{
			"src": "/uploads/gdpetfood.com/gs1/gs1-18332_-_chicken_breast_fillets_400g-gs1-gs1_packshot-2064-197-p.webp?v=bUfzGF",
			"alt": "فیله سینه مرغ | | VOSKES"
		},
		{
			"src": "/uploads/gdpetfood.com/gs1/gs1-18332_-_chicken_breast_fillets_400g_inhoud-gs1-gs1_product-2064-197-p.webp?v=bUfzHP",
			"alt": "فیله سینه مرغ | | VOSKES"
		}
	],
	"sliderPrevLabel": "اسلاید قبلی",
	"sliderNextLabel": "اسلاید بعدی",
	"available": {
		"label": "موجود در",
		"value": "۱۰۰ گرم | ۴۰۰ گرم"
	},
	"ctaHref": "https://www.mypetfoodshop.com/products/8711242931992",
	"composition": "مرغ 98٪، گلیسیرین، نمک",
	"analyticalComponents": "پروتئین خام 41.6٪ - خاکستر خام 2.4٪ - چربی خام 1.8٪ - فیبر خام 0.1٪ - رطوبت 25٪",
	"additives": null,
	"benefits": [],
	"extraHtml": null
}
