{
	"slug": "adult-sterilized-salmon",
	"sku": "20060",
	"gtin13": "8711242015371",
	"jsonLd": "{\n  \"@context\": \"https://schema.org\",\n  \"@type\": \"Product\",\n  \"description\": \"گربه های عقیم شده به دلیل تغییر متابولیسم، به رژیم غذایی با انرژی کمتری نیاز دارند. پسیلیوم و تفاله چغندر حس سیری بیشتری ایجاد می کنند و همچنین به کاهش تشکیل گلوله های مو کمک می کنند. ال کارنیتین برای تقویت چربی سوزی اضافه می شود. ترکیبی منحصر به فرد از گیاهان خشک - به طور طبیعی غنی از آنتی اکسیدان ها - به ایمنی خوب کمک می کند. مطالعات بالینی نشان می دهد که تشکیل پلاک و تارتار به لطف ویتامین C فسفریله اضافه شده کاهش می یابد. مقدار مواد معدنی برای کمک به یک دستگاه ادراری سالم تنظیم شده است. روغن ماهی باعث سلامت پوست و پوست می شود. در نهایت، اجزای پشتیبانی کننده مشترک نیز اضافه شده است. فرموله شده بدون ذرت یا گندم.\",\n  \"name\": \"ADULT STERILIZED SALMON\",\n  \"image\": \"/uploads/gdpetfood.com/original/gs1_voskes_a_sterilized_salmon_7kg_+30_hr.png\",\n  \"sku\": \"20060\",\n  \"gtin13\": \"8711242015371\",\n  \"brand\": {\n    \"@type\": \"Brand\",\n    \"name\": \"Voskes\"\n  }\n}",
	"title": "بالغ عقیم‌شده با سالمون | Voskes",
	"heading": "بالغ عقیم‌شده با سالمون",
	"description": "غذای کامل گربه بالغ. گربه‌های عقیم‌شده به دلیل تغییر سوخت‌وساز به رژیمی کم‌انرژی‌تر نیاز دارند.",
	"bodyDescription": "گربه های عقیم شده به دلیل تغییر متابولیسم، به رژیم غذایی با انرژی کمتری نیاز دارند. پسیلیوم و تفاله چغندر حس سیری بیشتری ایجاد می کنند و همچنین به کاهش تشکیل گلوله های مو کمک می کنند. ال کارنیتین برای تقویت چربی سوزی اضافه می شود. ترکیبی منحصر به فرد از گیاهان خشک - به طور طبیعی غنی از آنتی اکسیدان ها - به ایمنی خوب کمک می کند. مطالعات بالینی نشان می دهد که تشکیل پلاک و تارتار به لطف ویتامین C فسفریله اضافه شده کاهش می یابد. مقدار مواد معدنی برای کمک به یک دستگاه ادراری سالم تنظیم شده است. روغن ماهی باعث سلامت پوست و پوست می شود. در نهایت، اجزای پشتیبانی کننده مشترک نیز اضافه شده است. فرموله شده بدون ذرت یا گندم.",
	"ogTitle": "بالغ عقیم‌شده با سالمون | Voskes",
	"ogDescription": "غذای کامل گربه بالغ. گربه‌های عقیم‌شده به دلیل تغییر سوخت‌وساز به رژیمی کم‌انرژی‌تر نیاز دارند.",
	"canonical": "https://voskes.ir/products/adult-sterilized-salmon",
	"images": [
		{
			"src": "/uploads/gdpetfood.com/original/gs1_voskes_a_sterilized_salmon_7kg_+30_hr-p.webp",
			"alt": "ماهی آزاد استریل شده بالغ 7 وزن | ماهی آزاد استریل شده بزرگسالان ۷ آب | VOSKES"
		},
		{
			"src": "/uploads/gdpetfood.com/gs1/gs1-voskes-cat-adult15-gs1_product-2064-292.webp?v=bStV6m",
			"alt": "ماهی آزاد استریل شده بالغ 7 وزن | ماهی آزاد استریل شده بزرگسالان ۷ آب | VOSKES"
		}
	],
	"sliderPrevLabel": "اسلاید قبلی",
	"sliderNextLabel": "اسلاید بعدی",
	"available": {
		"label": "موجود در",
		"value": "۲ کیلوگرم | ۷ کیلوگرم"
	},
	"ctaHref": "https://www.mypetfoodshop.com/products/8711242015371",
	"composition": "ماهی آزاد (16%)، برنج، مرغ خشک، نخود فرنگی، سیب زمینی خشک، چربی حیوانی، تفاله چغندر، مواد معدنی، پروتئین مرغ هیدرولیز شده، فیبر گیاهی، مخمر آبجو، روغن ماهی، پوسته پسیلیوم، کلاژن، گلوکزامین، کندرویتین سولفات، m.o.s.، m.o.s. گیاهان خشک شده (rosmarinus sp. curcuma sp.، eugenia sp.).",
	"analyticalComponents": "33٪ پروتئین خام - 12.5٪ روغن و چربی خام - 2.5٪ الیاف خام - 7.7٪ خاکستر خام - 1.45٪ کلسیم - 1.15٪ فسفر",
	"additives": null,
	"benefits": [
		{
			"icon": "/uploads/icon/icon-en-weight_management-icon-130-9.png",
			"iconAlt": "Gewichtsmanagement",
			"description": "مدیریت وزن"
		},
		{
			"icon": "/uploads/icon/icon-en-strong_immunesystem-icon-130-8.png",
			"iconAlt": "Sterk immuunsysteem",
			"description": "سیستم ایمنی قوی"
		},
		{
			"icon": "/uploads/icon/icon-en-reduces_dental_plaque-icon-130-7.png",
			"iconAlt": "Vermindert tandplak",
			"description": "کاهش پلاک دندانی"
		},
		{
			"icon": "/uploads/icon/icon-en-healthy_urinary_tract-icon-130-4.png",
			"iconAlt": "Gezonde urinewegen",
			"description": "دستگاه ادراری سالم"
		},
		{
			"icon": "/uploads/icon/icon-en-healthy_skin_and_coat-icon-130-2.png",
			"iconAlt": "Gezonde huid & vacht",
			"description": "پوست و موی سالم"
		},
		{
			"icon": "/uploads/icon/icon-en-healthy_digestion-icon-130-1.png",
			"iconAlt": "Gezonde spijsvertering",
			"description": "گوارش سالم"
		}
	],
	"extraHtml": null
}
