{
	"slug": "jelly-tuna-with-beef",
	"sku": "20565",
	"gtin13": "8711242016828",
	"jsonLd": "{\n      \"@context\": \"https://schema.org\",\n      \"@type\": \"Product\",\n      \"description\": \" This delicious jelly treat made with tuna and beef is a veritable delicacy for every cat!  The natural ingredients are carefully steamed so that the nutrients and aromas are preserved. Cleaning, filleting and preparing tuna flakes, filling the tins and adding toppings are all done manually.  Tuna is easy to digest and contains essential fatty acids to support a shiny coat and healthy skin. Cats are crazy about this jelly taste sensation! \",\n    \"name\": \"JELLY TUNA   WITH BEEF\",\n    \"image\": \"https://sanux.100.nl/uploads/gdpetfood.com/original/gs1_20565_jelly_tuna_with_beef_blik.png\",\n    \"sku\": \"20565\",\n    \"gtin13\": \"8711242016828\",\n    \"brand\": {\n      \"@type\": \"Brand\",\n      \"name\": \"Voskes\"\n    }\n  }",
	"title": "Jelly tuna with beef | Voskes",
	"heading": "ژله ماهی تن  WITH BEEF",
	"description": "This cat snack is a delicious tuna-based treat with beef. A real treat for any cat!",
	"bodyDescription": "This delicious jelly treat made with tuna and beef is a veritable delicacy for every cat!The natural ingredients are carefully steamed so that the nutrients and aromas are preserved. Cleaning, filleting and preparing tuna flakes, filling the tins and adding toppings are all done manually.  Tuna is easy to digest and contains essential fatty acids to support a shiny coat and healthy skin. Cats are crazy about this jelly taste sensation!",
	"ogTitle": "Jelly tuna with beef | Voskes",
	"ogDescription": "This cat snack is a delicious tuna-based treat with beef. A real treat for any cat!",
	"canonical": "https://voskes.nl/en/products/jelly-tuna-with-beef",
	"images": [
		{
			"src": "https://sanux.100.nl/uploads/gdpetfood.com/original/gs1_20565_jelly_tuna_with_beef_blik.webp",
			"alt": "JELLY TUNA WITH BEEF | JELLY WETFOOD TUNA WITH BEEF | VOSKES"
		},
		{
			"src": "https://sanux.100.nl/uploads/gdpetfood.com/original/gs1_20565_jelly_tuna_with_beef1.webp",
			"alt": "JELLY TUNA WITH BEEF | JELLY WETFOOD TUNA WITH BEEF | VOSKES"
		}
	],
	"sliderPrevLabel": "اسلاید قبلی",
	"sliderNextLabel": "اسلاید بعدی",
	"available": {
		"label": "موجود در",
		"value": "۸۵ گرم"
	},
	"ctaHref": "https://www.mypetfoodshop.com/products/8711242016828",
	"composition": "tuna 51%, beef 4.7%, rice 1.5%, vegetable gelatine 0.75%.",
	"analyticalComponents": "moisture 85%, crude protein 12.5%, crude ash 0.8%, crude oils & fats 1.0%, crude fibre 0.5%.",
	"additives": null,
	"benefits": [],
	"extraHtml": null
}
