{
	"slug": "maxi-bones",
	"sku": "10969",
	"gtin13": "8711242998360",
	"jsonLd": "{\n      \"@context\": \"https://schema.org\",\n      \"@type\": \"Product\",\n      \"description\": \" These maxi bones are crunchy biscuits specially developed as treats for larger breeds. They can be given during training as a reward or simply as a snack to spoil your four-legged friend. Also ideal during the daily walk. Moreover, the biscuits are enriched with vitamins A, D3 and E! \",\n    \"name\": \"MAXI BONES\",\n    \"image\": \"https://sanux.100.nl/uploads/gdpetfood.com/gs1/gs1-10969_-_maxi_bones_750gr_-_gs1-gs1_packshot-2064-25.png?v=bUmGu1\",\n    \"sku\": \"10969\",\n    \"gtin13\": \"8711242998360\",\n    \"brand\": {\n      \"@type\": \"Brand\",\n      \"name\": \"Voskes\"\n    }\n  }",
	"title": "Maxi bones | Voskes",
	"heading": "MAXI BONES",
	"description": "These large chews are crunchy biscuits specially developed as treats for larger breeds. Moreover, the biscuits are enriched with vitamins A, D3 and E.",
	"bodyDescription": "These maxi bones are crunchy biscuits specially developed as treats for larger breeds. They can be given during training as a reward or simply as a snack to spoil your four-legged friend. Also ideal during the daily walk. Moreover, the biscuits are enriched with vitamins A, D3 and E!",
	"ogTitle": "Maxi bones | Voskes",
	"ogDescription": "These large chews are crunchy biscuits specially developed as treats for larger breeds. Moreover, the biscuits are enriched with vitamins A, D3 and E.",
	"canonical": "https://voskes.nl/en/products/maxi-bones",
	"images": [
		{
			"src": "https://sanux.100.nl/uploads/gdpetfood.com/gs1/gs1-10969_-_maxi_bones_750gr_-_gs1-gs1_packshot-2064-25-p.webp?v=bUmGu1",
			"alt": "MAXI BONES |  | VOSKES"
		},
		{
			"src": "https://sanux.100.nl/uploads/gdpetfood.com/gs1/gs1-10969_-_maxi_bones_750gr_inhoud_-_gs1-gs1_product-2064-25-p.webp?v=bUmGuA",
			"alt": "MAXI BONES |  | VOSKES"
		}
	],
	"sliderPrevLabel": "اسلاید قبلی",
	"sliderNextLabel": "اسلاید بعدی",
	"available": {
		"label": "موجود در",
		"value": "750gr"
	},
	"ctaHref": "https://www.mypetfoodshop.com/products/8711242998360",
	"composition": "Cereals, minerals, meat & animal derivatives, oils & fats, derivatives of vegetable origin.",
	"analyticalComponents": "Crude protein 14%, crude oils & fats 5.5%, crude ash 5%, crude fibre 2%.",
	"additives": "NUTRITIONAL ADDITIVES per kg: vitamin A: 5,000 I.U. - vitamin D3: 500 I.U. - vitamin E: 50 mg - 3b405 copper: 1.8 mg\nTECHNOLOGICAL ADDITIVES : Contains EU-approved antioxidants.",
	"benefits": [],
	"extraHtml": null
}
