{
	"slug": "adult-sterilized-salmon",
	"sku": "20060",
	"gtin13": "8711242015371",
	"jsonLd": "{\n      \"@context\": \"https://schema.org\",\n      \"@type\": \"Product\",\n      \"description\": \" Sterilized cats need a less energy-rich diet due to an altered metabolism. Psyllium and beet pulp provide a greater sense of satiety and also help reduce the formation of hairballs. L-carnitine is added to boost fat burning. A unique blend of dried plants – naturally rich in antioxidants – contribute to good immunity. Clinical studies show that plaque and tartar formation are reduced thanks to the added phosphorylated vitamin C. The amount of minerals is tailored to contribute to a healthy urinary tract. Fish oil promotes healthy skin and coat. Finally, joint-supporting components have also been added. Formulated without maize or wheat. \",\n    \"name\": \"ADULT STERILIZED SALMON\",\n    \"image\": \"https://sanux.100.nl/uploads/gdpetfood.com/original/gs1_voskes_a_sterilized_salmon_7kg_+30_hr.png\",\n    \"sku\": \"20060\",\n    \"gtin13\": \"8711242015371\",\n    \"brand\": {\n      \"@type\": \"Brand\",\n      \"name\": \"Voskes\"\n    }\n  }",
	"title": "Adult sterilized salmon | Voskes",
	"heading": "بالغ عقیم‌شده با سالمون",
	"description": "Complete pet food for adult cats. Sterilised cats need a less energy-rich diet due to an altered metabolism.",
	"bodyDescription": "Sterilized cats need a less energy-rich diet due to an altered metabolism. Psyllium and beet pulp provide a greater sense of satiety and also help reduce the formation of hairballs. L-carnitine is added to boost fat burning. A unique blend of dried plants – naturally rich in antioxidants – contribute to good immunity. Clinical studies show that plaque and tartar formation are reduced thanks to the added phosphorylated vitamin C. The amount of minerals is tailored to contribute to a healthy urinary tract. Fish oil promotes healthy skin and coat. Finally, joint-supporting components have also been added. Formulated without maize or wheat.",
	"ogTitle": "Adult sterilized salmon | Voskes",
	"ogDescription": "Complete pet food for adult cats. Sterilised cats need a less energy-rich diet due to an altered metabolism.",
	"canonical": "https://voskes.nl/en/products/adult-sterilized-salmon",
	"images": [
		{
			"src": "https://sanux.100.nl/uploads/gdpetfood.com/original/gs1_voskes_a_sterilized_salmon_7kg_+30_hr-p.webp",
			"alt": "ADULT STERILIZED SALMON 7KG | ADULT STERILIZED SALMON 7 KG | VOSKES"
		},
		{
			"src": "https://sanux.100.nl/uploads/gdpetfood.com/gs1/gs1-voskes-cat-adult15-gs1_product-2064-292.webp?v=bStV6m",
			"alt": "ADULT STERILIZED SALMON 7KG | ADULT STERILIZED SALMON 7 KG | VOSKES"
		}
	],
	"sliderPrevLabel": "اسلاید قبلی",
	"sliderNextLabel": "اسلاید بعدی",
	"available": {
		"label": "موجود در",
		"value": "۲ کیلوگرم | ۷ کیلوگرم"
	},
	"ctaHref": "https://www.mypetfoodshop.com/products/8711242015371",
	"composition": "dried salmon (16%), rice, dried chicken, peas, dried potatoes, animal fat, beet pulp, minerals, hydrolyzed chicken protein, vegetable fiber, brewer's yeast, fish oil, psyllium husk, collagen, glucosamine, chondroitin sulphate, g.o.s, m.o.s., f.o.s., β-glucans, dried plants (rosmarinus sp. curcuma sp., eugenia sp.).",
	"analyticalComponents": "33% crude protein - 12,5% crude oils and fats - 2,5% crude fibres - 7,7% crude ash - 1,45% calcium - 1,15% phosphore",
	"additives": null,
	"benefits": [
		{
			"icon": "/uploads/icon/icon-en-weight_management-icon-130-9.png",
			"iconAlt": "Gewichtsmanagement",
			"description": "Weight management"
		},
		{
			"icon": "/uploads/icon/icon-en-strong_immunesystem-icon-130-8.png",
			"iconAlt": "Sterk immuunsysteem",
			"description": "سیستم ایمنی قوی"
		},
		{
			"icon": "/uploads/icon/icon-en-reduces_dental_plaque-icon-130-7.png",
			"iconAlt": "Vermindert tandplak",
			"description": "کاهش پلاک دندانی"
		},
		{
			"icon": "/uploads/icon/icon-en-healthy_urinary_tract-icon-130-4.png",
			"iconAlt": "Gezonde urinewegen",
			"description": "دستگاه ادراری سالم"
		},
		{
			"icon": "/uploads/icon/icon-en-healthy_skin_and_coat-icon-130-2.png",
			"iconAlt": "Gezonde huid & vacht",
			"description": "پوست و موی سالم"
		},
		{
			"icon": "/uploads/icon/icon-en-healthy_digestion-icon-130-1.png",
			"iconAlt": "Gezonde spijsvertering",
			"description": "گوارش سالم"
		}
	],
	"extraHtml": null
}
