{
	"slug": "pig-ears-8-pcs",
	"sku": "11113",
	"gtin13": "87 112 42 98258 1",
	"jsonLd": "{\n      \"@context\": \"https://schema.org\",\n      \"@type\": \"Product\",\n      \"description\": \" Natural dried chewing product without additives. A lot of chewing pleasure which also helps to keep teeth healthy. \",\n    \"name\": \"PIG EARS   8 PIECES\",\n    \"image\": \"/uploads/gdpetfood.com/original/gs1_0-11113.png\",\n    \"sku\": \"11113\",\n    \"gtin13\": \"87 112 42 98258 1\",\n    \"brand\": {\n      \"@type\": \"Brand\",\n      \"name\": \"Voskes\"\n    }\n  }",
	"title": "گوش خوک | Voskes",
	"heading": "PIG EARS  ۸ عدد",
	"description": "محصول جویدنی طبیعی و خشک بدون افزودنی. لذت جویدن فراوان که به سلامت دندان‌ها هم کمک می‌کند.",
	"bodyDescription": "محصول جویدنی خشک‌شده طبیعی بدون افزودنی. لذت جویدن فراوان که به سلامت دندان‌ها نیز کمک می‌کند.",
	"ogTitle": "گوش خوک | Voskes",
	"ogDescription": "محصول جویدنی طبیعی و خشک بدون افزودنی. لذت جویدن فراوان که به سلامت دندان‌ها هم کمک می‌کند.",
	"canonical": "https://voskes.ir/products/pig-ears-8-pcs",
	"images": [
		{
			"src": "/uploads/gdpetfood.com/original/gs1_0-11113-p.webp",
			"alt": "PIG EARS - 8PCS | Varkensoren hond | رفتارهای Voskes | VOSKES"
		},
		{
			"src": "/uploads/gdpetfood.com/original/gs1_1-11113-p.webp",
			"alt": "PIG EARS - 8PCS | Varkensoren hond | رفتارهای Voskes | VOSKES"
		}
	],
	"sliderPrevLabel": "اسلاید قبلی",
	"sliderNextLabel": "اسلاید بعدی",
	"available": {
		"label": "موجود در",
		"value": "۲ عدد | ۸ عدد | ۱۰ عدد"
	},
	"ctaHref": "https://www.mypetfoodshop.com/products/8711242982581",
	"composition": "۱۰۰٪ گوشت خوک",
	"analyticalComponents": "crude protein 73.10% - crude fibre 0.1% - crude fat 15.3% - crude ash 2.0% - moisture content 10.9%",
	"additives": null,
	"benefits": [],
	"extraHtml": null
}
