{
	"slug": "jelly-chicken",
	"sku": "20562",
	"gtin13": "8711242016781",
	"jsonLd": "{\n      \"@context\": \"https://schema.org\",\n      \"@type\": \"Product\",\n      \"description\": \" This delicious jelly treat made with chicken is a veritable delicacy for every cat!  The natural ingredients are steamed so that the nutritious properties are well preserved. Cleaning and preparing the chicken, filling cans and adding toppings are all done manually. This delicious gluten-free chicken-based jelly treat is a real treat for any cat ! \",\n    \"name\": \"JELLY CHICKEN \",\n    \"image\": \"https://sanux.100.nl/uploads/gdpetfood.com/original/gs1_20562_jelly_chicken_blik.png\",\n    \"sku\": \"20562\",\n    \"gtin13\": \"8711242016781\",\n    \"brand\": {\n      \"@type\": \"Brand\",\n      \"name\": \"Voskes\"\n    }\n  }",
	"title": "Jelly chicken | Voskes",
	"heading": "JELLY CHICKEN",
	"description": "This cat snack is a delicious chicken-based treat. A real treat for any cat!",
	"bodyDescription": "This delicious jelly treat made with chicken is a veritable delicacy for every cat!The natural ingredients are steamed so that the nutritious properties are well preserved. Cleaning and preparing the chicken, filling cans and adding toppings are all done manually. This delicious gluten-free chicken-based jelly treat is a real treat for any cat !",
	"ogTitle": "Jelly chicken | Voskes",
	"ogDescription": "This cat snack is a delicious chicken-based treat. A real treat for any cat!",
	"canonical": "https://voskes.nl/en/products/jelly-chicken",
	"images": [
		{
			"src": "https://sanux.100.nl/uploads/gdpetfood.com/original/gs1_20562_jelly_chicken_blik.webp",
			"alt": "JELLY CHICKEN | JELLY WETFOOD CHICKEN | VOSKES"
		},
		{
			"src": "https://sanux.100.nl/uploads/gdpetfood.com/original/gs1_20562_jelly_chicken.webp",
			"alt": "JELLY CHICKEN | JELLY WETFOOD CHICKEN | VOSKES"
		}
	],
	"sliderPrevLabel": "اسلاید قبلی",
	"sliderNextLabel": "اسلاید بعدی",
	"available": {
		"label": "موجود در",
		"value": "۸۵ گرم"
	},
	"ctaHref": "https://www.mypetfoodshop.com/products/8711242016781",
	"composition": "chicken 35%, rice 1,5%, vegetable gelatine 1%",
	"analyticalComponents": "moisture 87%, crude protein 10%, crude ash 1,0%, crude oils & fats 0,8%, crude fibre 0,5%.",
	"additives": null,
	"benefits": [],
	"extraHtml": null
}
