{
	"slug": "kitten-pate-chicken-with-carrots-1",
	"sku": "21185",
	"gtin13": "8711242017528",
	"jsonLd": "{\n      \"@context\": \"https://schema.org\",\n      \"@type\": \"Product\",\n      \"description\": \" This creamy and delicious paté with chicken (40% !) and fine pieces of carrot is complete wet food for growing kittens. The paté contains 100% natural ingredients is completely grain-free and rich in taurine, vitamins A & E and in animal proteins. Krill meal was added as a source of high-quality proteins and essential fatty acids. In addition, our paté is a responsible and sustainable product as our tetra pack has a carbon footprint as much as 81% lower than other packaging and it is 100% recyclable!  There are 8 tetrapacks of 95gr in a box. 1 pack = 1 meal. \",\n    \"name\": \"KITTEN   PATÉ CHICKEN   WITH CARROTS\",\n    \"image\": \"https://sanux.100.nl/uploads/gdpetfood.com/gs1/gs1-20038_pate_chickencarrots_8pack_left_hr1-gs1_packshot-2064-278.png?v=bTUhaE\",\n    \"sku\": \"21185\",\n    \"gtin13\": \"8711242017528\",\n    \"brand\": {\n      \"@type\": \"Brand\",\n      \"name\": \"Voskes\"\n    }\n  }",
	"title": "بچه‌گربه؛ پته مرغ با هویج | Voskes",
	"heading": "بچه‌گربه  پته مرغ  با هویج",
	"description": "این پته کرمی و خوشمزه با ۴۰٪ مرغ و تکه‌های لطیف هویج، غذای تر کامل بچه‌گربه‌های در حال رشد است. ۱۰۰٪ مواد طبیعی.",
	"bodyDescription": "This creamy and delicious paté with chicken (40% !) and fine pieces of carrot is complete wet food for growing kittens. The paté contains 100% natural ingredients is completely grain-free and rich in taurine, vitamins A & E and in animal proteins. Krill meal was added as a source of high-quality proteins and essential fatty acids. In addition, our paté is a responsible and sustainable product as our tetra pack has a carbon footprint as much as 81% lower than other packaging and it is 100% recyclable!در هر جعبه ۸ بسته ۹۵ گرمی وجود دارد. هر بسته = یک وعده.",
	"ogTitle": "بچه‌گربه؛ پته مرغ با هویج | Voskes",
	"ogDescription": "این پته کرمی و خوشمزه با ۴۰٪ مرغ و تکه‌های لطیف هویج، غذای تر کامل بچه‌گربه‌های در حال رشد است. ۱۰۰٪ مواد طبیعی.",
	"canonical": "https://voskes.ir/products/kitten-pate-chicken-with-carrots-1",
	"images": [
		{
			"src": "https://sanux.100.nl/uploads/gdpetfood.com/gs1/gs1-20038_pate_chickencarrots_8pack_left_hr1-gs1_packshot-2064-278-p.webp?v=bTUhaE",
			"alt": "KITTEN PATÉ CHICKEN WITH CARROTS (8 X 95G) | KITTEN - PATÉ CHICKEN WITH CARROTS | VOSKES"
		},
		{
			"src": "https://sanux.100.nl/uploads/gdpetfood.com/original/gs1_pack_klein_patÉ_chicken_with_carrots-p.webp",
			"alt": "KITTEN PATÉ CHICKEN WITH CARROTS (8 X 95G) | KITTEN - PATÉ CHICKEN WITH CARROTS | VOSKES"
		},
		{
			"src": "https://sanux.100.nl/uploads/gdpetfood.com/original/gs1_product_patÉ_chicken_with_carrots-p.webp",
			"alt": "KITTEN PATÉ CHICKEN WITH CARROTS (8 X 95G) | KITTEN - PATÉ CHICKEN WITH CARROTS | VOSKES"
		}
	],
	"sliderPrevLabel": "اسلاید قبلی",
	"sliderNextLabel": "اسلاید بعدی",
	"available": {
		"label": "موجود در",
		"value": "۸ × ۹۵ گرم"
	},
	"ctaHref": "https://www.mypetfoodshop.com/products/8711242017528",
	"composition": "chicken 40%, carrots 6%, hydrolyzed chicken protein 3%, salmon oil 1.3%, krill meal 0.5%.",
	"analyticalComponents": "crude protein 9.2% - crude fat 5.5% - crude ash 2.1% - crude fibre 1.3% - moisture 80.6%",
	"additives": null,
	"benefits": [],
	"extraHtml": null
}
