{
	"slug": "liquid-treat-salmon",
	"sku": "21566",
	"gtin13": "8711242018587",
	"jsonLd": "{\n  \"@context\": \"https://schema.org\",\n  \"@type\": \"Product\",\n  \"description\": \"گربه خود را با خوراکی های مایع جدید ما با طعم ماهی قزل آلا - یک میان وعده خامه ای و غیرقابل مقاومت که نه تنها طعم لذیذی دارد، بلکه فواید سلامتی مهمی را نیز ارائه می دهد، بد کنید. به لطف افزودن روغن ماهی قزل آلا، غنی از اسیدهای چرب امگا 3، این درمان ها از پوست سالم و پوششی براق حمایت می کنند. اسید آمینه ضروری تورین همچنین از عملکرد قلب، بینایی و سیستم عصبی پشتیبانی می کند و به گربه شما کمک می کند تا حیاتی و پرانرژی بماند. آنتی اکسیدان ها دفاع طبیعی را تقویت کرده و از سلول ها در برابر تأثیرات مضر محافظت می کنند، در حالی که پری بیوتیک ها فلور سالم روده و هضم مطلوب را تقویت می کنند. به این ترتیب، گربه شما نه تنها از یک خوراکی خوشمزه لذت می برد، بلکه از حمایت ارزشمندی برای سلامتی خود نیز برخوردار می شود.\",\n  \"name\": \"LIQUID TREAT SALMON\",\n  \"image\": \"/uploads/gdpetfood.com/original/21566_-_8711242018587_-_liquid_treat_salmon_-_20x15gr_left.png\",\n  \"sku\": \"21566\",\n  \"gtin13\": \"8711242018587\",\n  \"brand\": {\n    \"@type\": \"Brand\",\n    \"name\": \"Voskes\"\n  }\n}",
	"title": "تشویقی مایع سالمون | Voskes",
	"heading": "LIQUID TREAT SALMON",
	"description": "Spoil your cat with our new Liquid Treats with salmon flavor – a creamy and irresistible snack that not only tastes delicious but also provides important health benefits. Thanks to the addition of salmon oil, rich in omega-3 fatty acids, these treats support healthy skin and a shiny coat. The essential amino acid taurine also supports heart function, vision, and the nervous system, helping your cat stay vital and energetic. Antioxidants strengthen the natural defenses and protect cells against harmful influences, while prebiotics promote a healthy gut flora and optimal digestion. This way, your cat not only enjoys a tasty treat but also receives valuable support for its health.",
	"bodyDescription": "گربه خود را با خوراکی های مایع جدید ما با طعم ماهی قزل آلا - یک میان وعده خامه ای و غیرقابل مقاومت که نه تنها طعم لذیذی دارد، بلکه فواید سلامتی مهمی را نیز ارائه می دهد، بد کنید. به لطف افزودن روغن ماهی قزل آلا، غنی از اسیدهای چرب امگا 3، این درمان ها از پوست سالم و پوششی براق حمایت می کنند. اسید آمینه ضروری تورین همچنین از عملکرد قلب، بینایی و سیستم عصبی پشتیبانی می کند و به گربه شما کمک می کند تا حیاتی و پرانرژی بماند. آنتی اکسیدان ها دفاع طبیعی را تقویت کرده و از سلول ها در برابر تأثیرات مضر محافظت می کنند، در حالی که پری بیوتیک ها فلور سالم روده و هضم مطلوب را تقویت می کنند. به این ترتیب، گربه شما نه تنها از یک خوراکی خوشمزه لذت می برد، بلکه از حمایت ارزشمندی برای سلامتی خود نیز برخوردار می شود.",
	"ogTitle": "تشویقی مایع سالمون | Voskes",
	"ogDescription": "Spoil your cat with our new Liquid Treats with salmon flavor – a creamy and irresistible snack that not only tastes delicious but also provides important health benefits. Thanks to the addition of salmon oil, rich in omega-3 fatty acids, these treats support healthy skin and a shiny coat. The essential amino acid taurine also supports heart function, vision, and the nervous system, helping your cat stay vital and energetic. Antioxidants strengthen the natural defenses and protect cells against harmful influences, while prebiotics promote a healthy gut flora and optimal digestion. This way, your cat not only enjoys a tasty treat but also receives valuable support for its health.",
	"canonical": "https://voskes.ir/products/liquid-treat-salmon",
	"images": [
		{
			"src": "/uploads/gdpetfood.com/original/21566_-_8711242018587_-_liquid_treat_salmon_-_20x15gr_left-p.webp",
			"alt": "ماهی آزاد درمان مایع (20 X 15G) | | VOSKES"
		},
		{
			"src": "/uploads/gdpetfood.com/original/21565-8711242018563-liquid-treat-tuna-15gr-content-p.webp",
			"alt": "ماهی آزاد درمان مایع (20 X 15G) | | VOSKES"
		}
	],
	"sliderPrevLabel": "اسلاید قبلی",
	"sliderNextLabel": "اسلاید بعدی",
	"available": {
		"label": "موجود در",
		"value": "۲۰ × ۱۵ گرم"
	},
	"ctaHref": "https://www.mypetfoodshop.com/products/8711242018587",
	"composition": "ماهی و مشتقات ماهی (سالمون 26%)، میوه، مشتقات با منشاء گیاهی، گوشت و مشتقات حیوانی، روغن ها و چربی ها (روغن ماهی قزل آلا 0.4%)، قندهای مختلف (FOS 0.04%)",
	"analyticalComponents": "رطوبت 89٪، پروتئین خام 5.5٪، خاکستر خام 1٪، روغن و چربی خام 1٪، فیبر خام 0.5٪",
	"additives": "افزودنی های تغذیه ای: تورین 500 میلی گرم بر کیلوگرم، ویتامین E 50 میلی گرم بر کیلوگرم، ویتامین C (3a300) 100 میلی گرم بر کیلوگرم، 3b604 100 میلی گرم بر کیلوگرم (Zn 22,74 میلی گرم بر کیلوگرم)",
	"benefits": [],
	"extraHtml": null
}
